{
  "schemaVersion": 1,
  "consumer": "flix-jetbrains-plugin",
  "description": "Maps the Grammar-Kit PSI element types of wstein/flix-jetbrains-plugin onto canonical TreeKind names. Partial by design. The dominant structural difference is a precedence-chain grammar: every expression descends through roughly seventeen levels (LAZY_FORCE_EXPR, NOT_EXPR, SIGN_EXPR, ADDITIVE_EXPR, ...), each a pass-through when its operator is absent. 30% of PSI nodes are always single-child wrappers, against 11.4% on the canonical side, so most of this map is transparency rather than renaming.",
  "mappings": {
    "FILE": "Root",
    "DEF_DECL": "Decl.Def",
    "ENUM_DECL": "Decl.Enum",
    "STRUCT_DECL": "Decl.Struct",
    "TRAIT_DECL": "Decl.Trait",
    "INSTANCE_DECL": "Decl.Instance",
    "TYPE_ALIAS_DECL": "Decl.TypeAlias",
    "QUALIFIED_NAME": "QName",
    "PARAMETER_LIST": "ParameterList",
    "PARAMETER": "Parameter",
    "ARGUMENT_LIST": "ArgumentList",
    "MODIFIER_LIST": "ModifierList",
    "ANNOTATION_LIST": "AnnotationList",
    "USES_OR_IMPORTS": "UsesOrImports.UseOrImportList",
    "LITERAL_EXPR": "Expr.Literal",
    "INFIX_APP_EXPR": "Expr.Binary",
    "ADDITIVE_EXPR": "Expr.Binary",
    "MULTIPLICATIVE_EXPR": "Expr.Binary",
    "RELATIONAL_EXPR": "Expr.Binary",
    "EQUALITY_EXPR": "Expr.Binary",
    "AND_EXPR": "Expr.Binary",
    "OR_EXPR": "Expr.Binary",
    "USER_OP_EXPR": "Expr.Binary",
    "CONS_EXPR": "Expr.Binary",
    "NOT_EXPR": "Expr.Unary",
    "SIGN_EXPR": "Expr.Unary",
    "STATEMENT": "Expr.Statement",
    "TYPE": "Type.Type",
    "ARROW_TYPE": "Type.Function",
    "TYPE_APPLICATION": "Type.Apply",
    "PsiErrorElement": "ErrorTree",
    "USE_DECL": "UsesOrImports.Use"
  },
  "ignored": [
    "ADDITIVE_EXPR",
    "ADD_SUB_TYPE",
    "AMP_TYPE",
    "AND_EXPR",
    "AND_TYPE",
    "ANNOTATION_LIST",
    "ARGUMENT",
    "ARGUMENT_LIST",
    "ARROW_TYPE",
    "ASSOCIATED_TYPE_SIG_DECL",
    "BAD_CHARACTER",
    "BLOCK",
    "BLOCK_OR_RECORD_EXPR",
    "CATCH_BODY",
    "CHANNEL_PUT_EXPR",
    "CHECKED_EFFECT_CAST_EXPR",
    "CHECKED_TYPE_CAST_EXPR",
    "CONSTANT_TYPE",
    "CONS_EXPR",
    "DEBUG_INTERPOLATOR_EXPR",
    "DECLARATION",
    "DISCARD_EXPR",
    "DUMMY_BLOCK",
    "ENUM_CASE",
    "ENUM_DECL",
    "EQUALITY_EXPR",
    "EXPR",
    "EXPR_DELIMITED",
    "EXTENSIBLE_TYPE",
    "EXT_TAG_EXPR",
    "FILE",
    "FIXPOINT_CONSTRAINT",
    "FIXPOINT_CONSTRAINT_SET_EXPR",
    "FIXPOINT_SOLVE_EXPR",
    "FUNCTIONAL",
    "FlixTokenType.!",
    "FlixTokenType.$",
    "FlixTokenType.(",
    "FlixTokenType.)",
    "FlixTokenType.,",
    "FlixTokenType.->",
    "FlixTokenType..",
    "FlixTokenType./",
    "FlixTokenType.:",
    "FlixTokenType.;",
    "FlixTokenType.<=>",
    "FlixTokenType.=",
    "FlixTokenType.=>",
    "FlixTokenType.???",
    "FlixTokenType.DOT",
    "FlixTokenType.NAME_LOWERCASE",
    "FlixTokenType.[",
    "FlixTokenType.\\",
    "FlixTokenType.]",
    "FlixTokenType.^",
    "FlixTokenType._",
    "FlixTokenType.block comment",
    "FlixTokenType.case",
    "FlixTokenType.def",
    "FlixTokenType.doc comment",
    "FlixTokenType.false",
    "FlixTokenType.identifier",
    "FlixTokenType.import",
    "FlixTokenType.instance",
    "FlixTokenType.int literal",
    "FlixTokenType.let",
    "FlixTokenType.line comment",
    "FlixTokenType.match",
    "FlixTokenType.new",
    "FlixTokenType.pub",
    "FlixTokenType.run",
    "FlixTokenType.static",
    "FlixTokenType.string interpolation start",
    "FlixTokenType.string literal",
    "FlixTokenType.true",
    "FlixTokenType.use",
    "FlixTokenType.{",
    "FlixTokenType.}",
    "GUARD",
    "GUARD_FRAGMENT",
    "HOLE_EXPR",
    "HOLE_VARIABLE_EXPR",
    "INFIX_APP_EXPR",
    "INSTANCEOF_EXPR",
    "INTERPOLATED_STRING_EXPR",
    "INTRINSIC_EXPR",
    "INVOKE_SUPER_EXPR",
    "KIND",
    "LAZY_FORCE_EXPR",
    "LIST_LITERAL_EXPR",
    "LITERAL_EXPR",
    "LITERAL_PATTERN",
    "MAP_LITERAL_EXPR",
    "MODIFIER_LIST",
    "MULTIPLICATIVE_EXPR",
    "NOT_EXPR",
    "OPEN_VARIANT_EXPR",
    "OR_EXPR",
    "OR_TYPE",
    "PARAMETER",
    "PARAMETER_LIST",
    "PAREN_OR_TUPLE_OR_LAMBDA_EXPR",
    "PATTERN",
    "PATTERN_LIST",
    "POSTFIX_EXPR",
    "PREDICATE_AND_ARITY",
    "PREDICATE_ATOM",
    "PREDICATE_BODY",
    "PREDICATE_HEAD",
    "PREDICATE_PARAM_LIST",
    "PsiErrorElement",
    "QUALIFIED_NAME",
    "QUALIFIED_TYPE_NAME",
    "RECORD_FIELD_PATTERN",
    "RECORD_FIELD_TYPE",
    "RECORD_OP",
    "RECORD_OR_EFFECT_SET_TYPE",
    "RECORD_TYPE",
    "REGION_EXPR",
    "REGION_NAME",
    "RELATIONAL_EXPR",
    "RV_ADD_SUB_TYPE",
    "RV_AND_TYPE",
    "SCHEMA_ROW_TYPE",
    "SCHEMA_TYPE",
    "SET_LITERAL_EXPR",
    "SIGN_EXPR",
    "STATEMENT",
    "STRUCT_FIELD_INIT",
    "STRUCT_PUT_EXPR",
    "TAG_BODY_PATTERN",
    "TAG_PATTERN",
    "TERM_LIST",
    "THROW_EXPR",
    "TRAIT_DECL",
    "TUPLE_OR_RECORD_ROW_TYPE",
    "TUPLE_TYPE",
    "TYPE",
    "TYPE_AND_EFFECT",
    "TYPE_APPLICATION",
    "TYPE_ARGUMENT",
    "TYPE_ARGUMENT_LIST",
    "TYPE_CONSTRAINTS",
    "TYPE_DELIMITED",
    "TYPE_PARAMETER",
    "TYPE_PARAMETER_LIST",
    "UNARY_LAMBDA_EXPR",
    "UNARY_PATTERN",
    "UNARY_TYPE_LEVEL",
    "USER_OP_EXPR",
    "USES_OR_IMPORTS",
    "USE_DECL",
    "USE_MANY",
    "VARIABLE_PATTERN",
    "WITH_BODY",
    "XOR_TYPE"
  ],
  "elide": [
    "Type.Type",
    "Argument",
    "Pattern.Variable",
    "Type.Argument",
    "Type.Effect",
    "Predicate.Body",
    "Expr.Expr",
    "UsesOrImports.UseOrImportList",
    "AnnotationList",
    "ModifierList",
    "Doc",
    "CommentList",
    "QName",
    "Expr.Statement",
    "Pattern.Pattern",
    "Type.Apply"
  ],
  "notes": {
    "ADDITIVE_EXPR": "Both mapped and ignored, deliberately: a pass-through on every expression without a `+`, a real binary expression when one is present. Elision fires only at arity <= 1, so the two entries describe different positions.",
    "PsiErrorElement": "IntelliJ's error node, the counterpart of the reference's ErrorTree.",
    "DECLARATION": "Transparent only, never mapped: it wraps whichever concrete declaration follows (DEF_DECL, ENUM_DECL, ...) and is not itself a declaration kind."
  }
}
