{
  "schemaVersion": 1,
  "consumer": "tree-sitter-flix",
  "description": "Maps tree-sitter-flix's snake_case node vocabulary onto canonical TreeKind names. Partial by design: it covers the node types the fixture suite actually exercises. Anything neither mapped nor ignored is reported as unmapped, which is a gap rather than a decision, so the report distinguishes 'not mapped yet' from 'disagrees with the reference'.",
  "mappings": {
    "source_file": "Root",
    "module_declaration": "Decl.Module",
    "function_declaration": "Decl.Def",
    "enum_declaration": "Decl.Enum",
    "struct_declaration": "Decl.Struct",
    "trait_declaration": "Decl.Trait",
    "instance_declaration": "Decl.Instance",
    "effect_declaration": "Decl.Effect",
    "type_alias_declaration": "Decl.TypeAlias",
    "signature_declaration": "Decl.Signature",
    "operation_declaration": "Decl.Op",
    "law_declaration": "Decl.Law",
    "parameter_list": "ParameterList",
    "parameter": "Parameter",
    "argument_list": "ArgumentList",
    "named_argument": "ArgumentNamed",
    "qualified_name": "QName",
    "name_lower": "Ident",
    "name_upper": "Ident",
    "apply_expression": "Expr.Apply",
    "binary_expression": "Expr.Binary",
    "unary_expression": "Expr.Unary",
    "paren_expression": "Expr.Paren",
    "block_expression": "Expr.Block",
    "if_expression": "Expr.IfThenElse",
    "match_expression": "Expr.Match",
    "lambda_expression": "Expr.Lambda",
    "tuple_expression": "Expr.Tuple",
    "let_expression": "Expr.LetMatch",
    "hole_anonymous": "Expr.Hole",
    "variable_pattern": "Pattern.Variable",
    "tuple_pattern": "Pattern.Tuple",
    "tag_pattern": "Pattern.Tag",
    "type_variable": "Type.Variable",
    "tuple_type": "Type.Tuple",
    "type_argument_list": "Type.ArgumentList",
    "type_argument": "Type.Argument",
    "effect_annotation": "Type.Effect",
    "use_declaration": "UsesOrImports.Use",
    "import_declaration": "UsesOrImports.Import"
  },
  "ignored": [
    "argument",
    "block_comment",
    "comment",
    "derivations",
    "doc_comment",
    "enum_body",
    "line_comment",
    "type_reference"
  ],
  "elide": [
    "AnnotationList",
    "Argument",
    "CommentList",
    "Doc",
    "Expr.Expr",
    "Expr.Statement",
    "ModifierList",
    "Pattern.Pattern",
    "Pattern.Variable",
    "Predicate.Body",
    "QName",
    "Type.Apply",
    "Type.Argument",
    "Type.Effect",
    "Type.Type",
    "UsesOrImports.UseOrImportList"
  ],
  "notes": {
    "name_lower": "Both name_lower and name_upper collapse to Ident: the reference does not distinguish case in the tree, only in the lexer.",
    "type_reference": "Transparent, not mapped: the reference wraps most types in Type.Type, which is elided on the expected side, so the consumer's equivalent wrapper must be dropped symmetrically.",
    "QName": "Elided only when single-child: the reference wraps a lone identifier in QName, which tree-sitter emits bare. A multi-part QName (Foo.Bar) has several children and is kept, so genuine qualification is still compared.",
    "argument": "Transparent, not mapped: canonical Argument is a single-child wrapper and is elided on the expected side, so the consumer's equivalent must be dropped symmetrically."
  }
}
